{
 "schema": "visitflow/problem",
 "version": "1.0",
 "inputs_hash": "sha256:10aa0079170b1393a46246b887e0493df124edf5d7fd6f3b067c619749fa0131",
 "line_id": "08",
 "calendar": {
  "dates": [
   "2026-07-01",
   "2026-07-02",
   "2026-07-03",
   "2026-07-06",
   "2026-07-07",
   "2026-07-08",
   "2026-07-09",
   "2026-07-10",
   "2026-07-13",
   "2026-07-14",
   "2026-07-15",
   "2026-07-16",
   "2026-07-17",
   "2026-07-20",
   "2026-07-21",
   "2026-07-22",
   "2026-07-23",
   "2026-07-24",
   "2026-07-27",
   "2026-07-28",
   "2026-07-29",
   "2026-07-30",
   "2026-07-31"
  ],
  "n_days": 23
 },
 "stores": [
  {
   "id": 0,
   "code": "660480005",
   "lon": 113.238608,
   "lat": 23.12445,
   "contract": {
    "kind": "W",
    "phase": 0,
    "required_visits": 4
   },
   "legal_dates_idx": [
    0,
    1,
    2,
    3,
    4,
    5,
    6,
    7,
    8,
    9,
    10,
    11,
    12,
    13,
    14,
    15,
    16,
    17,
    18,
    19,
    20,
    21,
    22
   ]
  },
  {
   "id": 1,
   "code": "700172019",
   "lon": 113.23109,
   "lat": 23.124921,
   "contract": {
    "kind": "W",
    "phase": 0,
    "required_visits": 4
   },
   "legal_dates_idx": [
    0,
    1,
    2,
    3,
    4,
    5,
    6,
    7,
    8,
    9,
    10,
    11,
    12,
    13,
    14,
    15,
    16,
    17,
    18,
    19,
    20,
    21,
    22
   ]
  },
  {
   "id": 2,
   "code": "710382976",
   "lon": 113.229515,
   "lat": 23.119873,
   "contract": {
    "kind": "W",
    "phase": 0,
    "required_visits": 4
   },
   "legal_dates_idx": [
    0,
    1,
    2,
    3,
    4,
    5,
    6,
    7,
    8,
    9,
    10,
    11,
    12,
    13,
    14,
    15,
    16,
    17,
    18,
    19,
    20,
    21,
    22
   ]
  },
  {
   "id": 3,
   "code": "990057926",
   "lon": 113.249131,
   "lat": 23.109571,
   "contract": {
    "kind": "W",
    "phase": 0,
    "required_visits": 4
   },
   "legal_dates_idx": [
    0,
    1,
    2,
    3,
    4,
    5,
    6,
    7,
    8,
    9,
    10,
    11,
    12,
    13,
    14,
    15,
    16,
    17,
    18,
    19,
    20,
    21,
    22
   ]
  },
  {
   "id": 4,
   "code": "990057963",
   "lon": 113.228666,
   "lat": 23.123804,
   "contract": {
    "kind": "W",
    "phase": 0,
    "required_visits": 4
   },
   "legal_dates_idx": [
    0,
    1,
    2,
    3,
    4,
    5,
    6,
    7,
    8,
    9,
    10,
    11,
    12,
    13,
    14,
    15,
    16,
    17,
    18,
    19,
    20,
    21,
    22
   ]
  },
  {
   "id": 5,
   "code": "990057967",
   "lon": 113.228696,
   "lat": 23.122657,
   "contract": {
    "kind": "W",
    "phase": 0,
    "required_visits": 4
   },
   "legal_dates_idx": [
    0,
    1,
    2,
    3,
    4,
    5,
    6,
    7,
    8,
    9,
    10,
    11,
    12,
    13,
    14,
    15,
    16,
    17,
    18,
    19,
    20,
    21,
    22
   ]
  },
  {
   "id": 6,
   "code": "990057979",
   "lon": 113.235647,
   "lat": 23.111748,
   "contract": {
    "kind": "W",
    "phase": 0,
    "required_visits": 4
   },
   "legal_dates_idx": [
    0,
    1,
    2,
    3,
    4,
    5,
    6,
    7,
    8,
    9,
    10,
    11,
    12,
    13,
    14,
    15,
    16,
    17,
    18,
    19,
    20,
    21,
    22
   ]
  },
  {
   "id": 7,
   "code": "990057986",
   "lon": 113.23609,
   "lat": 23.111394,
   "contract": {
    "kind": "W",
    "phase": 0,
    "required_visits": 4
   },
   "legal_dates_idx": [
    0,
    1,
    2,
    3,
    4,
    5,
    6,
    7,
    8,
    9,
    10,
    11,
    12,
    13,
    14,
    15,
    16,
    17,
    18,
    19,
    20,
    21,
    22
   ]
  },
  {
   "id": 8,
   "code": "990058438",
   "lon": 113.252538,
   "lat": 23.123002,
   "contract": {
    "kind": "W",
    "phase": 0,
    "required_visits": 4
   },
   "legal_dates_idx": [
    0,
    1,
    2,
    3,
    4,
    5,
    6,
    7,
    8,
    9,
    10,
    11,
    12,
    13,
    14,
    15,
    16,
    17,
    18,
    19,
    20,
    21,
    22
   ]
  },
  {
   "id": 9,
   "code": "990058521",
   "lon": 113.250069,
   "lat": 23.123196,
   "contract": {
    "kind": "W",
    "phase": 0,
    "required_visits": 4
   },
   "legal_dates_idx": [
    0,
    1,
    2,
    3,
    4,
    5,
    6,
    7,
    8,
    9,
    10,
    11,
    12,
    13,
    14,
    15,
    16,
    17,
    18,
    19,
    20,
    21,
    22
   ]
  },
  {
   "id": 10,
   "code": "990058523",
   "lon": 113.248327,
   "lat": 23.124244,
   "contract": {
    "kind": "W",
    "phase": 0,
    "required_visits": 4
   },
   "legal_dates_idx": [
    0,
    1,
    2,
    3,
    4,
    5,
    6,
    7,
    8,
    9,
    10,
    11,
    12,
    13,
    14,
    15,
    16,
    17,
    18,
    19,
    20,
    21,
    22
   ]
  },
  {
   "id": 11,
   "code": "990059345",
   "lon": 113.233775,
   "lat": 23.123783,
   "contract": {
    "kind": "W",
    "phase": 0,
    "required_visits": 4
   },
   "legal_dates_idx": [
    0,
    1,
    2,
    3,
    4,
    5,
    6,
    7,
    8,
    9,
    10,
    11,
    12,
    13,
    14,
    15,
    16,
    17,
    18,
    19,
    20,
    21,
    22
   ]
  },
  {
   "id": 12,
   "code": "20000714501",
   "lon": 113.250169,
   "lat": 23.123468,
   "contract": {
    "kind": "W",
    "phase": 0,
    "required_visits": 4
   },
   "legal_dates_idx": [
    0,
    1,
    2,
    3,
    4,
    5,
    6,
    7,
    8,
    9,
    10,
    11,
    12,
    13,
    14,
    15,
    16,
    17,
    18,
    19,
    20,
    21,
    22
   ]
  },
  {
   "id": 13,
   "code": "20000716902",
   "lon": 113.228029,
   "lat": 23.122616,
   "contract": {
    "kind": "W",
    "phase": 0,
    "required_visits": 4
   },
   "legal_dates_idx": [
    0,
    1,
    2,
    3,
    4,
    5,
    6,
    7,
    8,
    9,
    10,
    11,
    12,
    13,
    14,
    15,
    16,
    17,
    18,
    19,
    20,
    21,
    22
   ]
  },
  {
   "id": 14,
   "code": "20000748734",
   "lon": 113.232942,
   "lat": 23.112264,
   "contract": {
    "kind": "W",
    "phase": 0,
    "required_visits": 4
   },
   "legal_dates_idx": [
    0,
    1,
    2,
    3,
    4,
    5,
    6,
    7,
    8,
    9,
    10,
    11,
    12,
    13,
    14,
    15,
    16,
    17,
    18,
    19,
    20,
    21,
    22
   ]
  },
  {
   "id": 15,
   "code": "30000228289",
   "lon": 113.231144,
   "lat": 23.117473,
   "contract": {
    "kind": "W",
    "phase": 0,
    "required_visits": 4
   },
   "legal_dates_idx": [
    0,
    1,
    2,
    3,
    4,
    5,
    6,
    7,
    8,
    9,
    10,
    11,
    12,
    13,
    14,
    15,
    16,
    17,
    18,
    19,
    20,
    21,
    22
   ]
  },
  {
   "id": 16,
   "code": "30000274712",
   "lon": 113.247093,
   "lat": 23.119512,
   "contract": {
    "kind": "W",
    "phase": 0,
    "required_visits": 4
   },
   "legal_dates_idx": [
    0,
    1,
    2,
    3,
    4,
    5,
    6,
    7,
    8,
    9,
    10,
    11,
    12,
    13,
    14,
    15,
    16,
    17,
    18,
    19,
    20,
    21,
    22
   ]
  },
  {
   "id": 17,
   "code": "30000744926",
   "lon": 113.201766,
   "lat": 23.107924,
   "contract": {
    "kind": "W",
    "phase": 0,
    "required_visits": 4
   },
   "legal_dates_idx": [
    0,
    1,
    2,
    3,
    4,
    5,
    6,
    7,
    8,
    9,
    10,
    11,
    12,
    13,
    14,
    15,
    16,
    17,
    18,
    19,
    20,
    21,
    22
   ]
  },
  {
   "id": 18,
   "code": "30001382519",
   "lon": 113.235255,
   "lat": 23.124799,
   "contract": {
    "kind": "W",
    "phase": 0,
    "required_visits": 4
   },
   "legal_dates_idx": [
    0,
    1,
    2,
    3,
    4,
    5,
    6,
    7,
    8,
    9,
    10,
    11,
    12,
    13,
    14,
    15,
    16,
    17,
    18,
    19,
    20,
    21,
    22
   ]
  },
  {
   "id": 19,
   "code": "30001411982",
   "lon": 113.241679,
   "lat": 23.125501,
   "contract": {
    "kind": "W",
    "phase": 0,
    "required_visits": 4
   },
   "legal_dates_idx": [
    0,
    1,
    2,
    3,
    4,
    5,
    6,
    7,
    8,
    9,
    10,
    11,
    12,
    13,
    14,
    15,
    16,
    17,
    18,
    19,
    20,
    21,
    22
   ]
  },
  {
   "id": 20,
   "code": "20000712216",
   "lon": 113.236327,
   "lat": 23.115997,
   "contract": {
    "kind": "B",
    "phase": 0,
    "required_visits": 2
   },
   "legal_dates_idx": [
    3,
    4,
    5,
    6,
    7,
    13,
    14,
    15,
    16,
    17
   ]
  },
  {
   "id": 21,
   "code": "20000712393",
   "lon": 113.237634,
   "lat": 23.113999,
   "contract": {
    "kind": "B",
    "phase": 0,
    "required_visits": 2
   },
   "legal_dates_idx": [
    3,
    4,
    5,
    6,
    7,
    13,
    14,
    15,
    16,
    17
   ]
  },
  {
   "id": 22,
   "code": "20000712440",
   "lon": 113.236376,
   "lat": 23.117328,
   "contract": {
    "kind": "B",
    "phase": 0,
    "required_visits": 2
   },
   "legal_dates_idx": [
    3,
    4,
    5,
    6,
    7,
    13,
    14,
    15,
    16,
    17
   ]
  },
  {
   "id": 23,
   "code": "20000712536",
   "lon": 113.235645,
   "lat": 23.116862,
   "contract": {
    "kind": "B",
    "phase": 0,
    "required_visits": 2
   },
   "legal_dates_idx": [
    3,
    4,
    5,
    6,
    7,
    13,
    14,
    15,
    16,
    17
   ]
  },
  {
   "id": 24,
   "code": "20000716294",
   "lon": 113.238833,
   "lat": 23.108187,
   "contract": {
    "kind": "B",
    "phase": 0,
    "required_visits": 2
   },
   "legal_dates_idx": [
    3,
    4,
    5,
    6,
    7,
    13,
    14,
    15,
    16,
    17
   ]
  },
  {
   "id": 25,
   "code": "30001528533",
   "lon": 113.215173,
   "lat": 23.128232,
   "contract": {
    "kind": "B",
    "phase": 0,
    "required_visits": 2
   },
   "legal_dates_idx": [
    3,
    4,
    5,
    6,
    7,
    13,
    14,
    15,
    16,
    17
   ]
  },
  {
   "id": 26,
   "code": "30001529838",
   "lon": 113.238798,
   "lat": 23.108209,
   "contract": {
    "kind": "B",
    "phase": 0,
    "required_visits": 2
   },
   "legal_dates_idx": [
    3,
    4,
    5,
    6,
    7,
    13,
    14,
    15,
    16,
    17
   ]
  },
  {